{
  "assignment_uri": "https://grip.opdrachtgever.example/id/opdracht/3f2a8c54-6d1b-4f0e-9a77-1c2b3d4e5f60",
  "status": "in_progress",
  "as_of": "2026-09-30",
  "summary": "Eerste versie opgeleverd.",
  "milestones": [
    {
      "description": "Eerste versie",
      "due_date": "2026-09-15",
      "state": "done"
    },
    {
      "description": "Tweede versie",
      "due_date": null,
      "state": "planned"
    }
  ],
  "delivered": [
    "Eerste versie"
  ],
  "not_delivered": []
}
